commit	sampler	split	frontier_score	fid_N5	fid_N9	fid_N11	fid_N13	peak_vram_mb	status	notes
de25906	research	proxy	2.607512	27.1643	10.5599	8.9761	7.6810	2186.8	keep	trend-consistent virtual predictor sanity screen
a99fb43	research	proxy	2.607512	27.1642	10.5600	8.9758	7.6814	2186.8	keep	
af251d0	research	proxy	0.000000	0.0000	0.0000	0.0000	0.0000	0.0	crash	ERK-guided terminal Heun sanity screen Unable to load the EDM Inception detector for FID evaluation. Set SAMPLER_AUTORESEARCH_ALLOW_APPROX_FID=1 only for offline tests or local smoke runs.
af251d0	research	proxy	2.607503	27.1630	10.5602	8.9761	7.6811	2187.0	keep	ERK-guided terminal Heun sanity screen
e223901	research	proxy	2.607542	27.1635	10.5608	8.9764	7.6816	2187.0	keep	ERK-guided terminal Heun reduced-scale sanity screen
